{
  "type": "aos.employer_brand_live_evidence_element_clip_manifest",
  "schema_version": "2026-05-employer-brand-live-evidence-element-clip-manifest-v0",
  "id": "live-evidence-element-clip-manifest:symphony-talent-phenom-radancy",
  "label": "Symphony Talent Employer Brand Live Evidence Repaired Locator Capture Plan Live Element Clip Manifest",
  "status": "not_accepted",
  "source_refs": {
    "repair_patch_id": "live-evidence-capture-repair-patch:symphony-talent-phenom-radancy",
    "repair_patch_path": "live-evidence-capture-repair-patch.json",
    "repair_patch_application_id": "live-evidence-capture-repair-patch-application:symphony-talent-phenom-radancy",
    "repair_patch_application_path": "live-evidence-capture-repair-patch.application.json",
    "failure_review_pack_id": "live-evidence-capture-failure-review-pack:symphony-talent-phenom-radancy",
    "failure_review_pack_path": "live-evidence-capture-failure-review-pack.json",
    "manifest_id": "live-evidence-element-clip-manifest:symphony-talent-phenom-radancy",
    "manifest_path": "source-artifacts/live-evidence-element-clip-manifest.json",
    "reviewed_locator_capture_plan_id": "live-evidence-reviewed-locator-capture-plan:symphony-talent-phenom-radancy",
    "reviewed_locator_capture_plan_path": "live-evidence-reviewed-locator-capture-plan.json",
    "reviewed_locator_readiness_id": "live-evidence-locator-readiness-reviewed:symphony-talent-phenom-radancy",
    "reviewed_locator_readiness_path": "live-evidence-locator-readiness.reviewed.json",
    "url_open_run_id": "live-evidence-url-open-run:symphony-talent-phenom-radancy",
    "url_open_run_path": "live-evidence-url-open-run.json",
    "reviewed_target_plan_id": "live-evidence-reviewed-target-plan:symphony-talent-phenom-radancy",
    "reviewed_target_plan_path": "live-evidence-target-plan.reviewed.json",
    "data_bundle_id": "employer-brand-comparative-audit-data-bundle:symphony-talent-phenom-radancy",
    "data_bundle_path": "data-bundle.json",
    "read_only": true
  },
  "capture_plan": {
    "id": "live-evidence-repaired-locator-capture-plan:symphony-talent-phenom-radancy",
    "path": "live-evidence-repaired-locator-capture-plan.json",
    "schema": "shared/schemas/employer-brand-live-evidence-repaired-locator-capture-plan-v0.schema.json"
  },
  "summary": {
    "executable_unit_count": 4,
    "planned_output_slot_count": 4,
    "captured_slot_count": 0,
    "failed_slot_count": 4,
    "blocked_not_run_count": 15,
    "total_manifest_entry_count": 19,
    "full_page_grab_count": 0,
    "text_extract_required_count": 4,
    "text_extract_present_count": 0,
    "acceptance_passed": false
  },
  "entries": [
    {
      "slot_id": "live-reviewed-capture-work-unit:symphony-talent-careers-site:slot:1",
      "target_id": "live-target:symphony-talent:careers-site",
      "work_unit_id": "live-reviewed-capture-work-unit:symphony-talent-careers-site",
      "company": "Symphony Talent",
      "company_role": "client",
      "source_category": "careers_site",
      "original_url": "https://www.symphonytalent.com/",
      "final_url": "https://www.symphonytalent.com/",
      "reviewed_locator": {
        "selector": "section#home-hero",
        "xpath": null,
        "playwright_locator": null
      },
      "locator_provenance": {
        "decision": "approve_repaired_locator",
        "repair_item_id": "live-evidence-capture-repair:1",
        "human_notes": "DOM-only supervised review of the approved URL verified section#home-hero resolves to one visible hero section containing the Symphony Talent employer promise; no screenshot, clip, full-page grab, text extract, codegen, crawl, or login bypass was performed.",
        "provenance": {
          "source_repair_patch_path": "live-evidence-capture-repair-patch.json",
          "operator_reviewed_by": "operator:gdi",
          "operator_reviewed_at": "2026-05-09T00:13:06Z",
          "preserves_original_slot_identity": true,
          "planned_only": true,
          "read_only_source_context": true
        }
      },
      "capture_type": "element_clip_and_text_extract",
      "clip_path": null,
      "text_extract_path": null,
      "text_extract_content": null,
      "kilos_relevance": [
        "impact",
        "opportunity"
      ],
      "citation_source_metadata": {
        "data_bundle_id": "employer-brand-comparative-audit-data-bundle:symphony-talent-phenom-radancy",
        "source_category": "careers_site",
        "page_name": "Symphony Talent careers_site",
        "evidence_goal": "Confirm Symphony Talent career-site positioning and visible employee value proposition proof for KILOS scoring.",
        "desired_element": "Human-selected careers homepage hero or EVP proof block that states the employer promise without capturing the full page.",
        "citation": {
          "source_url": "https://www.symphonytalent.com/",
          "provenance_only": true
        }
      },
      "acceptance_criteria_refs": [
        "The captured evidence is scoped to one visible element, not the full page.",
        "The element is visibly the intended repaired evidence target.",
        "The element includes enough surrounding text to understand the employer promise out of context."
      ],
      "citation_refs": [],
      "capture_timestamp": "2026-05-09T14:58:08.285Z",
      "full_page_grab": false,
      "status": "failed",
      "blocker_reason": "reviewed_locator_element_not_visible",
      "required_next_action": "review_capture_blocker_before_retry",
      "retry_eligibility": "requires_non_runtime_review",
      "capture_metadata": {
        "executor": "2026-05-employer-brand-reviewed-live-element-capture-v0",
        "backend": "playwright_node_api",
        "backend_command": "playwright-cli",
        "locator_kind": "selector",
        "match_count": 1,
        "title": "Talent Acquisition Software | Recruitment CRM & Marketing Solutions",
        "current_url": "https://www.symphonytalent.com/",
        "viewport": {
          "width": 1440,
          "height": 900
        },
        "frame_count": null,
        "total_frame_match_count": null,
        "frame_match_counts": [],
        "clip_path_planned": "source-artifacts/live-evidence-element-clips/reviewed-locator/symphony-talent/careers-site/symphony-talent-careers-site-slot-1.png",
        "text_extract_path_planned": "source-artifacts/live-evidence-text-extracts/reviewed-locator/symphony-talent/careers-site/symphony-talent-careers-site-slot-1.txt",
        "runner_type": "playwright_node_api",
        "runner_version": "2026-05-employer-brand-live-evidence-slot-capture-runner-v0",
        "failed_command_surface": "playwright_node_api",
        "execution_phase": "element_visibility_check",
        "failed_phase": "element_visibility_check",
        "started_phases": [
          "runner_preflight",
          "browser_readiness",
          "browser_launch",
          "page_navigation",
          "locator_evaluation",
          "element_visibility_check"
        ],
        "completed_phases": [
          "runner_preflight",
          "browser_readiness",
          "browser_launch",
          "page_navigation",
          "locator_evaluation",
          "element_visibility_check"
        ],
        "phase_timings_ms": {
          "runner_preflight": 14,
          "browser_readiness": 203,
          "browser_launch": 127,
          "page_navigation": 4289,
          "locator_evaluation": 8,
          "element_visibility_check": 4
        },
        "phase_timeout_ms": 45000,
        "tool_path": "/Users/Michael/.nvm/versions/node/v22.22.0/lib/node_modules/@playwright/test/cli.js",
        "timeout_ms": 45000,
        "timed_out": false,
        "exit_status": 0,
        "exit_signal": null,
        "error_code": null,
        "error_message": null,
        "stdout_snippet": null,
        "stderr_snippet": null,
        "missing_browser_executable_path": null,
        "browser_cache_path": null,
        "repair_command": null,
        "working_directory": "/Users/Michael/Code/agent-os",
        "retry_recommendation": "repair_capture_runtime_before_retry",
        "environment_assumptions": {
          "playwright_command": "playwright-cli",
          "local_command_resolution_required": true,
          "shell_lookup": true,
          "browser_readiness_check": false,
          "missing_browser_executable_path": null,
          "browser_cache_path": null,
          "repair_command": null
        }
      },
      "acceptance_checks": [
        {
          "name": "clip_asset_exists",
          "status": "fail"
        },
        {
          "name": "text_extract_present",
          "status": "fail"
        },
        {
          "name": "full_page_grab_false",
          "status": "pass"
        },
        {
          "name": "target_work_unit_linkage_present",
          "status": "pass"
        },
        {
          "name": "locator_provenance_present",
          "status": "pass"
        },
        {
          "name": "kilos_citation_metadata_present",
          "status": "pass"
        }
      ],
      "provenance": {
        "read_only": true,
        "reviewed_locator_only": true,
        "approved_original_or_final_url_only": true,
        "no_full_page_grab": true,
        "non_goal_controls": [
          "autonomous_crawl",
          "autonomous_browsing",
          "locator_codegen",
          "locator_discovery",
          "unreviewed_locators",
          "full_page_grabs",
          "report_renderer",
          "html_css_polish",
          "pdf_export",
          "docx_export",
          "workflow_engine",
          "login_bypass",
          "paywall_bypass",
          "captcha_bypass",
          "consent_bypass"
        ],
        "source_capture_plan_path": "live-evidence-repaired-locator-capture-plan.json",
        "source_repair_patch_path": "live-evidence-capture-repair-patch.json",
        "source_reviewed_locator_readiness_path": null,